{
  "protocol": "nd.extension/1",
  "id": "nd.example.journal",
  "name": "Journal Example",
  "description": "Minimal example package: a journal command, a notes view, and one nonsecret setting, built only from allowlisted ND host methods.",
  "version": "1.0.0",
  "apiVersion": 1,
  "contexts": ["personal", "company"],
  "permissions": ["notes.read", "notes.write"],
  "settings": [
    {
      "key": "prompt",
      "title": "Journal prompt",
      "type": "string",
      "default": "What moved today?",
      "description": "Shown as the example command hint; overridable per context in Extensions settings."
    }
  ],
  "contributions": {
    "commands": [
      {
        "id": "journal-quick-add",
        "title": "Add journal entry",
        "description": "Save what you typed as a note in the selected context.",
        "keywords": ["journal", "log", "diary"],
        "contexts": ["personal", "company"],
        "host": "note.create"
      }
    ],
    "views": [
      {
        "id": "journal-entries",
        "title": "Journal entries",
        "description": "No journal entries in this context yet.",
        "kind": "list",
        "host": "note.search",
        "itemTitleKey": "title",
        "itemBodyKey": "body",
        "contexts": ["personal", "company"],
        "actions": [
          { "id": "journal-open", "title": "Open entry", "host": "note.open" },
          { "id": "journal-delete", "title": "Delete entry", "host": "note.delete" }
        ]
      }
    ]
  }
}
