{
  "protocol": "nd.extension/1",
  "id": "com.example.wallpaper",
  "name": "My Wallpaper Command",
  "description": "Example user-authored native extension using ND's governed wallpaper capability.",
  "version": "1.0.0",
  "apiVersion": 1,
  "contexts": [
    "personal"
  ],
  "permissions": [
    "os.wallpaper.write"
  ],
  "settings": [],
  "contributions": {
    "commands": [
      {
        "id": "choose-wallpaper",
        "title": "Choose my wallpaper",
        "description": "Pick an image through ND and set it as the desktop wallpaper.",
        "keywords": [
          "wallpaper",
          "desktop",
          "background"
        ],
        "contexts": [
          "personal"
        ],
        "host": "os.wallpaper.chooseAndSet"
      }
    ]
  }
}
