{
  "protocol": "nd.extension/1",
  "id": "nd.youtube-mini",
  "name": "ND YouTube Mini",
  "description": "Play and manage YouTube from ND with background playback in the ND browser and ad blocking on by default. This M1 scaffold contributes a launcher command that opens the queue view, a command that saves a video link, and the list view over saved entries; transport controls, player state, and default-on ad blocking arrive in later milestones.",
  "version": "0.1.0",
  "apiVersion": 1,
  "contexts": ["personal", "company", "project"],
  "permissions": ["browser.navigate", "notes.read", "notes.write"],
  "settings": [],
  "contributions": {
    "commands": [
      {
        "id": "youtube-mini-open",
        "title": "ND YouTube Mini",
        "description": "Open the YouTube Mini queue view.",
        "keywords": ["youtube", "video", "player", "watch", "playback", "music"],
        "host": "browser.openUrl",
        "openViewId": "youtube-mini-queue",
        "contexts": ["personal", "company", "project"]
      },
      {
        "id": "youtube-mini-save",
        "title": "Save a YouTube video",
        "description": "Save the typed video link as a YouTube Mini queue entry.",
        "keywords": ["youtube", "save", "queue", "video", "link"],
        "host": "note.create",
        "contexts": ["personal", "company", "project"]
      }
    ],
    "views": [
      {
        "id": "youtube-mini-queue",
        "title": "YouTube Mini queue",
        "description": "No saved videos yet. Type a YouTube link and run Save a YouTube video.",
        "kind": "list",
        "host": "note.search",
        "itemTitleKey": "title",
        "itemBodyKey": "body",
        "contexts": ["personal", "company", "project"],
        "actions": [
          { "id": "youtube-mini-open-entry", "title": "Open entry", "host": "note.open" }
        ]
      }
    ]
  }
}
